SN,Title,Author,Published,Link
313,Participants Selection for From-Scratch Mobile Crowdsensing via Reinforcement Learning,"Wang, J.",29 Jun 2020,https://pureportal.coventry.ac.uk/en/publications/participants-selection-for-from-scratch-mobile-crowdsensing-via-r
314,Swarm-Intelligence-Based Rendezvous Selection via Edge Computing for Mobile Sensor Networks,"Wang, J.",Oct 2020,https://pureportal.coventry.ac.uk/en/publications/swarm-intelligence-based-rendezvous-selection-via-edge-computing-
315,Task allocation based on node pair intimacy in wireless sensor networks,"Wang, J.",1 Jul 2020,https://pureportal.coventry.ac.uk/en/publications/task-allocation-based-on-node-pair-intimacy-in-wireless-sensor-ne
316,"What Happens in Peer-Support, Stays in Peer-Support: Software Architecture for Peer-Sourcing in Mental Health","Wang, J.",22 Sept 2020,https://pureportal.coventry.ac.uk/en/publications/what-happens-in-peer-support-stays-in-peer-support-software-archi
317,Will online digital footprints reveal your relationship status? an empirical study of social applications for sexual-minority men,"Wang, J.",18 Mar 2020,https://pureportal.coventry.ac.uk/en/publications/will-online-digital-footprints-reveal-your-relationship-status-an
318,Allocating Heterogeneous Tasks in Participatory Sensing with Diverse Participant-Side Factors,"Wang, J.",Sept 2019,https://pureportal.coventry.ac.uk/en/publications/allocating-heterogeneous-tasks-in-participatory-sensing-with-dive
319,A Survey of Task Allocation: Contrastive Perspectives from Wireless Sensor Networks and Mobile Crowdsensing,"Wang, J.",27 Jun 2019,https://pureportal.coventry.ac.uk/en/publications/a-survey-of-task-allocation-contrastive-perspectives-from-wireles
320,CAMP: Co-Attention Memory Networks for Diagnosis Prediction in Healthcare,"Wang, J.",Nov 2019,https://pureportal.coventry.ac.uk/en/publications/camp-co-attention-memory-networks-for-diagnosis-prediction-in-hea
321,Crowd-Assisted Machine Learning: Current Issues and Future Directions,"Wang, J.",1 Jan 2019,https://pureportal.coventry.ac.uk/en/publications/crowd-assisted-machine-learning-current-issues-and-future-directi
322,Learning-Assisted Optimization in Mobile Crowd Sensing: A Survey,"Wang, J.",1 Jan 2019,https://pureportal.coventry.ac.uk/en/publications/learning-assisted-optimization-in-mobile-crowd-sensing-a-survey
323,MLRDA: A multi-task semi-supervised learning framework for drug-drug interaction prediction,"Wang, J.",16 Aug 2019,https://pureportal.coventry.ac.uk/en/publications/mlrda-a-multi-task-semi-supervised-learning-framework-for-drug-dr
324,Social-Network-Assisted Worker Recruitment in Mobile Crowd Sensing,"Wang, J.",1 Jul 2019,https://pureportal.coventry.ac.uk/en/publications/social-network-assisted-worker-recruitment-in-mobile-crowd-sensin
325,STAR: Spatio-temporal taxonomy-aware tag recommendation for citizen complaints,"Wang, J.",3 Nov 2019,https://pureportal.coventry.ac.uk/en/publications/star-spatio-temporal-taxonomy-aware-tag-recommendation-for-citize
326,Enabling Human-Centric Smart Cities: Crowdsourcing-Based Practice in China,"Wang, J.",1 Dec 2018,https://pureportal.coventry.ac.uk/en/publications/enabling-human-centric-smart-cities-crowdsourcing-based-practice-
327,Views and Experiences of Healthcare Practitioners Supporting People with Copd Who Have Used Activity Monitors: “More than Just Steps”,"Wilde, L.",12 Jun 2023,https://pureportal.coventry.ac.uk/en/publications/views-and-experiences-of-healthcare-practitioners-supporting-peop
328,Developing public transport messaging to provide crowding information during COVID-19: Application of the COM-B model and behaviour change wheel,"Wilde, L. J.",Mar 2022,https://pureportal.coventry.ac.uk/en/publications/developing-public-transport-messaging-to-provide-crowding-informa
329,Protocol for a single-centre mixed-method pre–post single-arm feasibility trial of a culturally appropriate 6-week pulmonary rehabilitation programme among adults with functionally limiting chronic respiratory diseases in Malawi,,31 Jan 2022,https://pureportal.coventry.ac.uk/en/publications/protocol-for-a-single-centre-mixed-method-prepost-single-arm-feas
330,"Systematic Review of Physical Activity, Sedentary Behaviour and Sleep Among Adults Living with Chronic Respiratory Disease in Low- and Middle-Income Countries.","Wilde, L. J.",18 Apr 2022,https://pureportal.coventry.ac.uk/en/publications/systematic-review-of-physical-activity-sedentary-behaviour-and-sl
331,What Are the Experiences of People with COPD Using Activity Monitors?: A Qualitative Scoping Review,"Wilde, L. J.",31 Dec 2022,https://pureportal.coventry.ac.uk/en/publications/what-are-the-experiences-of-people-with-copd-using-activity-monit
332,‘It’s definitely the future’: Healthcare practitioners’ views and experiences of activity monitors to support people with chronic obstructive pulmonary disease (COPD),"Wilde, L. J.",11 Nov 2022,https://pureportal.coventry.ac.uk/en/publications/its-definitely-the-future-healthcare-practitioners-views-and-expe
333,‘It’s really just been a learning experience’: A qualitative study to explore the experiences of people with chronic obstructive pulmonary disease (COPD) using activity monitors,"Wilde, L. J.",11 Nov 2022,https://pureportal.coventry.ac.uk/en/publications/its-really-just-been-a-learning-experience-a-qualitative-study-to
334,“Addicted to the tracker”?: Experiences of people with Chronic Obstructive Pulmonary Disease (COPD) using activity trackers,"Wilde, L. J.",25 Mar 2022,https://pureportal.coventry.ac.uk/en/publications/addicted-to-the-tracker-experiences-of-people-with-chronic-obstru
335,Implementing a digital intervention for managing uncontrolled hypertension in Primary Care: a mixed methods process evaluation,"Wilde, L.",26 May 2021,https://pureportal.coventry.ac.uk/en/publications/implementing-a-digital-intervention-for-managing-uncontrolled-hyp
336,Mobile health apps: An exploration of user-generated reviews in Google Play store on a physical activity application,"Wilde, L. J.",2021,https://pureportal.coventry.ac.uk/en/publications/mobile-health-apps-an-exploration-of-user-generated-reviews-in-go
337,"Developing a digital intervention for cancer survivors: an evidence-, theory- and person-based approach",,2 Sept 2019,https://pureportal.coventry.ac.uk/en/publications/developing-a-digital-intervention-for-cancer-survivors-an-evidenc
338,Renewed: Protocol for a randomised controlled trial of a digital intervention to support quality of life in cancer survivors,"Wilde, L. J.",1 Mar 2019,https://pureportal.coventry.ac.uk/en/publications/renewed-protocol-for-a-randomised-controlled-trial-of-a-digital-i
339,Apps and wearables for monitoring physical activity and sedentary behaviour: a qualitative systematic review protocol on barriers and facilitators,"Wilde, L. J.",2018,https://pureportal.coventry.ac.uk/en/publications/apps-and-wearables-for-monitoring-physical-activity-and-sedentary
340,Apps and wearables to monitor physical activity and sedentary behaviour: Findings from a qualitative systematic review on barriers and facilitators,"Wilde, L. J.",15 Oct 2018,https://pureportal.coventry.ac.uk/en/publications/apps-and-wearables-to-monitor-physical-activity-and-sedentary-beh-2
341,Apps and wearables to monitor physical activity and sedentary behaviour: Preliminary findings from a qualitative systematic review on barriers and facilitators,"Wilde, L. J.",5 Jun 2018,https://pureportal.coventry.ac.uk/en/publications/apps-and-wearables-to-monitor-physical-activity-and-sedentary-beh
342,"Exploring cancer survivors’ views of health behavior change: ""Where do you start, where do you stop with everything?""","Wilde, L. J.",Jul 2018,https://pureportal.coventry.ac.uk/en/publications/exploring-cancer-survivors-views-of-health-behavior-change-where-
343,Long-term use of mobile phone apps and wearables to support physical activity: from barriers and facilitators to guidelines,"Wilde, L. J.",24 May 2017,https://pureportal.coventry.ac.uk/en/publications/long-term-use-of-mobile-phone-apps-and-wearables-to-support-physi
344,Combined cognitive biases for pain and disability information in individuals with chronic headache: A preliminary investigation,"Parry, L. J.",24 Aug 2016,https://pureportal.coventry.ac.uk/en/publications/combined-cognitive-biases-for-pain-and-disability-information-in-
345,Non-specific Mechanisms in Orthodox and CAM management of low back pain (MOCAM). Theoretical framework and protocol for a prospective cohort study,"Parry, L. J.",27 May 2016,https://pureportal.coventry.ac.uk/en/publications/non-specific-mechanisms-in-orthodox-and-cam-management-of-low-bac
346,Digital Peer-Supported Self-Management Intervention Codesigned by People With Long COVID: Mixed Methods Proof-of-Concept Study,"Wright, H.",14 Oct 2022,https://pureportal.coventry.ac.uk/en/publications/digital-peer-supported-self-management-intervention-codesigned-by
347,Give the people what they want: evidence-based peer support for Long COVID,"Wright, H.",29 Mar 2022,https://pureportal.coventry.ac.uk/en/publications/give-the-people-what-they-want-evidence-based-peer-support-for-lo
348,Older Individuals Convicted of Sexual Offenses: A Literature Review,"Tramontano, C.",Apr 2022,https://pureportal.coventry.ac.uk/en/publications/older-individuals-convicted-of-sexual-offenses-a-literature-revie
349,A Digital Self-management Program (Help to Overcome Problems Effectively) for People Living With Cancer: Feasibility Randomized Controlled Trial ,"Wright, H.",5 Nov 2021,https://pureportal.coventry.ac.uk/en/publications/a-digital-self-management-program-help-to-overcome-problems-effec
350,A ray of HOPE: digital self-management for people living with cancer during COVID-19,"Wright, H.",26 Jan 2021,https://pureportal.coventry.ac.uk/en/publications/a-ray-of-hope-digital-self-management-for-people-living-with-canc
351,Fostering Distance Education: Lessons From a United States-England Partnered Collaborative Online International Learning Approach,"Wright, H.",1 Dec 2021,https://pureportal.coventry.ac.uk/en/publications/fostering-distance-education-lessons-from-a-united-states-england
352,Introducing the tablet-based Oxford Cognitive Screen-Plus (OCS-Plus) as an assessment tool for subtle cognitive impairments,"Wright, H.",Dec 2021,https://pureportal.coventry.ac.uk/en/publications/introducing-the-tablet-based-oxford-cognitive-screen-plus-ocs-plu
353,World Stroke Day 2021: Let’s talk about sex,"Wright, H.",29 Oct 2021,https://pureportal.coventry.ac.uk/en/publications/world-stroke-day-2021-lets-talk-about-sex
354,A Digital Program (Hope) for People Living With Cancer During the COVID-19 Pandemic: Protocol for a Feasibility Randomized Controlled Trial,"Wright, H.",4 Dec 2020,https://pureportal.coventry.ac.uk/en/publications/a-digital-program-hope-for-people-living-with-cancer-during-the-c
355,Help to Overcome Problems Effectively for Cancer Survivors: Development and Evaluation of a Digital Self-Management Program,"Wright, H.",19 May 2020,https://pureportal.coventry.ac.uk/en/publications/help-to-overcome-problems-effectively-for-cancer-survivors-develo
356,Sexual expression and cognitive function: gender-divergent associations in older adults,"Wright, H.",Apr 2020,https://pureportal.coventry.ac.uk/en/publications/sexual-expression-and-cognitive-function-gender-divergent-associa
357,Frequent sexual activity predicts specific cognitive abilities in older adults,"Wright, H.",Jan 2019,https://pureportal.coventry.ac.uk/en/publications/frequent-sexual-activity-predicts-specific-cognitive-abilities-in
358,Associations between cognitive function and sexual activities in later life,"Wright, H.",2017,https://pureportal.coventry.ac.uk/en/publications/associations-between-cognitive-function-and-sexual-activities-in-
359,"Exploring the Links Between Cognition and Sexual Activity: Cognitive Flexibility, Dopamine and the Prefrontal Cortex","Wright, H.",2017,https://pureportal.coventry.ac.uk/en/publications/exploring-the-links-between-cognition-and-sexual-activity-cogniti
360,Five things that reduce the risk of cognitive decline with age,"Wright, H.",25 Aug 2017,https://pureportal.coventry.ac.uk/en/publications/five-things-that-reduce-the-risk-of-cognitive-decline-with-age
361,Handy tips for surviving a conference: an introvert’s guide,"Wright, H.",31 Aug 2017,https://pureportal.coventry.ac.uk/en/publications/handy-tips-for-surviving-a-conference-an-introverts-guide
362,Sexuality and ageing research: perspectives of a cognitive psychologist,"Wright, H.",Jul 2017,https://pureportal.coventry.ac.uk/en/publications/sexuality-and-ageing-research-perspectives-of-a-cognitive-psychol
363,Frequency of Sexual Activity in Ageing Populations: Implications for Cognitive Function,"Wright, H.",5 Sept 2016,https://pureportal.coventry.ac.uk/en/publications/frequency-of-sexual-activity-in-ageing-populations-implications-f
364,How Much is Enough? Potential Benefits of an Active Sex Life on Working Memory,"Wright, H.",2016,https://pureportal.coventry.ac.uk/en/publications/how-much-is-enough-potential-benefits-of-an-active-sex-life-on-wo
365,"""No Particular Place to Go"": Gender, Sexuality and Sexual Health Help-Seeking in UK Older Adults","Wright, H.",2016,https://pureportal.coventry.ac.uk/en/publications/no-particular-place-to-go-gender-sexuality-and-sexual-health-help
366,Research in the Media: Is All Publicity ‘Good’ Publicity?,"Wright, H.",2016,https://pureportal.coventry.ac.uk/en/publications/research-in-the-media-is-all-publicity-good-publicity
367,Sex and Cognition in Later Life: Exploring Links Between Intimacy and Brain Function,"Wright, H.",2016,https://pureportal.coventry.ac.uk/en/publications/sex-and-cognition-in-later-life-exploring-links-between-intimacy-
368,Sex on the brain! Associations between sexual activity and cognitive function in older age,"Wright, H.",2016,https://pureportal.coventry.ac.uk/en/publications/sex-on-the-brain-associations-between-sexual-activity-and-cogniti-2
369,Cross-sectional associations between sexual activity and cognitive function in the English Longitudinal Study of Ageing,"Wright, H.",2015,https://pureportal.coventry.ac.uk/en/publications/cross-sectional-associations-between-sexual-activity-and-cognitiv
370,"Gender, cognition and cognitive lifestyle in the English Longitudinal Study of Ageing","Wright, H.",2015,https://pureportal.coventry.ac.uk/en/publications/gender-cognition-and-cognitive-lifestyle-in-the-english-longitudi
371,Sex on the Brain: Associations between Cognitive Function and Sexual Activity in Community-Dwelling Older Adults in England,"Wright, H.",6 Nov 2015,https://pureportal.coventry.ac.uk/en/publications/sex-on-the-brain-associations-between-cognitive-function-and-sexu
372,The effect of expectancy of sleep induction on sleep quality using objective and subjective measures,"Wright, H.",2015,https://pureportal.coventry.ac.uk/en/publications/the-effect-of-expectancy-of-sleep-induction-on-sleep-quality-usin-2
373,Cross-Sectional Study of Sleep Quantity and Quality and Amnestic and Non-Amnestic Cognitive Function in an Ageing Population: The English Longitudinal Study of Ageing (ELSA),"Wright, H.",26 Jun 2014,https://pureportal.coventry.ac.uk/en/publications/cross-sectional-study-of-sleep-quantity-and-quality-and-amnestic--2
374,Sleep and Cognition,"Wright, H.",24 Sept 2014,https://pureportal.coventry.ac.uk/en/publications/sleep-and-cognition-2
375,Sleep Disturbances and Cognitive Function in the English Longitudinal Study of Ageing,"Wright, H.",25 Jun 2014,https://pureportal.coventry.ac.uk/en/publications/sleep-disturbances-and-cognitive-function-in-the-english-longitud-2
376,Sleep Disturbances and Mild Cognitive Impairment in the English Longitudinal Study of Ageing,"Wright, H.",1 Sept 2013,https://pureportal.coventry.ac.uk/en/publications/sleep-disturbances-and-mild-cognitive-impairment-in-the-english-l-4
377,Sleep Disturbances and Mild Cognitive Impairment in the English Longitudinal Study of Ageing,"Wright, H.",1 Jun 2013,https://pureportal.coventry.ac.uk/en/publications/sleep-disturbances-and-mild-cognitive-impairment-in-the-english-l-3
378,The contribution of stimulus-driven and goal-driven mechanisms to feature-based selection in patients with spatial attention deficits,"Wright, H.",2012,https://pureportal.coventry.ac.uk/en/publications/the-contribution-of-stimulus-driven-and-goal-driven-mechanisms-to
379,An amygdala response to fearful faces with covered eyes,"Wright, H.",2008,https://pureportal.coventry.ac.uk/en/publications/an-amygdala-response-to-fearful-faces-with-covered-eyes
380,Calcium Activation of Parvalbumin Neurons Induced by Electrical Motor Cortex Stimulation,"Xu, Y.",8 Sept 2022,https://pureportal.coventry.ac.uk/en/publications/calcium-activation-of-parvalbumin-neurons-induced-by-electrical-m
381,Regional identification of information flow termination of electrohysterographic signals: Towards understanding human uterine electrical propagation,"Xu, Y.",Aug 2022,https://pureportal.coventry.ac.uk/en/publications/regional-identification-of-information-flow-termination-of-electr
382,Uterus Modeling from Cell to Organ Level: towards Better Understanding of Physiological Basis of Uterine Activity,"Xu, Y.",2022,https://pureportal.coventry.ac.uk/en/publications/uterus-modeling-from-cell-to-organ-level-towards-better-understan
383,Automatic recognition of uterine contractions with electrohysterogram signals based on the zero-crossing rate,"Xu, Y.",21 Jan 2021,https://pureportal.coventry.ac.uk/en/publications/automatic-recognition-of-uterine-contractions-with-electrohystero
384,Development and validation of a deep learning-based automatic auscultatory blood pressure measurement method,"Xu, Y.",Jul 2021,https://pureportal.coventry.ac.uk/en/publications/development-and-validation-of-a-deep-learning-based-automatic-aus
385,Evaluation of cuff deflation and inflation rates on a deep learning-based automatic blood pressure measurement method: a pilot evaluation study,"Xu, Y.",1 Apr 2021,https://pureportal.coventry.ac.uk/en/publications/evaluation-of-cuff-deflation-and-inflation-rates-on-a-deep-learni
386,Analysis of Electrohysterographic Signal Propagation Direction during Uterine Contraction: the Application of Directed Information,"Xu, Y.",27 Aug 2020,https://pureportal.coventry.ac.uk/en/publications/analysis-of-electrohysterographic-signal-propagation-direction-du
387,Dataset on Blood Flow and Instantaneous Wave-free Ratio in Normal and Stenosed Coronary Arteries,"Liu, H.",Oct 2020,https://pureportal.coventry.ac.uk/en/publications/dataset-on-blood-flow-and-instantaneous-wave-free-ratio-in-normal
388,Effect of microcirculatory resistance on coronary blood flow and instantaneous wave-free ratio: A computational study,"Liu, H.",1 Nov 2020,https://pureportal.coventry.ac.uk/en/publications/effect-of-microcirculatory-resistance-on-coronary-blood-flow-and-
389,Significance of considering respiratory movement in estimating sleep stage,"Liu, H.",18 Mar 2020,https://pureportal.coventry.ac.uk/en/publications/significance-of-considering-respiratory-movement-in-estimating-sl
390,Cortico-Muscular Coherence Enhancement Via Sparse Signal Representation,"Xu, Y.",13 Sept 2018,https://pureportal.coventry.ac.uk/en/publications/cortico-muscular-coherence-enhancement-via-sparse-signal-represen
391,Cortico-muscular coherence enhancement via coherent Wavelet enhanced Independent Component Analysis,"Xu, Y.",14 Sept 2017,https://pureportal.coventry.ac.uk/en/publications/cortico-muscular-coherence-enhancement-via-coherent-wavelet-enhan
392,Corticomuscular Coherence With Time Lag With Application to Delay Estimation,"Xu, Y.",Mar 2017,https://pureportal.coventry.ac.uk/en/publications/corticomuscular-coherence-with-time-lag-with-application-to-delay
393,Delay estimation between EEG and EMG via coherence with time lag,"Xu, Y.",19 May 2016,https://pureportal.coventry.ac.uk/en/publications/delay-estimation-between-eeg-and-emg-via-coherence-with-time-lag
